id,title,description
1,Konoha Frontier,Wilayah awal yang tenang dengan sumber daya hutan yang melimpah.
2,Great Beast Forest,Hutan lebat yang dihuni oleh banyak hewan liar untuk berburu.
3,Hidden Grove,Area terpencil yang memiliki cadangan kayu paling tua dan besar.
4,Wild Pass,Jalur perbatasan yang didominasi oleh predator dan hewan buas.
5,Silent Valley,Lembah sunyi yang seimbang antara kayu dan hasil buruan.
6,Deep Jungle,Hutan rimba yang sangat rapat dan sulit untuk ditembus.
7,Stag Territory,Padang rumput luas yang menjadi tempat berkumpulnya kawanan rusa.
8,Primal Land,Tanah kuno dengan sumber daya alam paling kaya untuk dieksploitasi.